{
  "$schema": "../../.modcreator/schema/tool.json",
  "kind": "tool",
  "id": "azurite_pickaxe",
  "name": "Azurite Pickaxe",
  "creativeTab": "tools_and_utilities",
  "tool": {
    "type": "pickaxe",
    "texture": "art/azurite_pickaxe.png",
    "tier": "iron",
    "durability": 600,
    "miningSpeed": 7,
    "attackDamage": 3.5,
    "attackSpeed": -2.8,
    "enchantability": 18,
    "repairItem": "azurite"
  }
}
